{
  "schema_version": "deep-read.v1",
  "paper_id": "icml-2026-19ec66cff1c1",
  "bibliography": {
    "title": "Online Conformal Prediction via Universal Portfolio Algorithms",
    "conference": "ICML",
    "year": 2026,
    "selection_flags": [
      "spotlight"
    ],
    "authors": [
      "Tuo Liu",
      "Edgar Dobriban",
      "Francesco Orabona"
    ],
    "version_note": "Verified arXiv preprint 2602.03168v1 dated February 4, 2026; the analysis follows this PDF."
  },
  "source_files": {
    "pdf": "corpus/preprints/icml-2026-19ec66cff1c1.pdf",
    "pdf_verified": true,
    "supplementary": null,
    "openreview_url": "https://openreview.net/forum?id=EKmiOtjZjI",
    "source_kind": "verified_preprint",
    "source_url": "https://arxiv.org/pdf/2602.03168"
  },
  "page_map": {
    "pdf_pages": 63,
    "main_pages": 12,
    "reference_pages": 3,
    "appendix_pages": 48,
    "sections": [
      {
        "title": "Title, authors, and Abstract",
        "module": "abstract",
        "start_page": 1,
        "end_page": 1,
        "estimated_words": 170
      },
      {
        "title": "1 Introduction",
        "module": "introduction",
        "start_page": 1,
        "end_page": 3,
        "estimated_words": 1020
      },
      {
        "title": "Related Work (embedded in Introduction)",
        "module": "related_work",
        "start_page": 2,
        "end_page": 3,
        "estimated_words": 740
      },
      {
        "title": "2 Notation and Problem Setup",
        "module": "method",
        "start_page": 3,
        "end_page": 4,
        "estimated_words": 480
      },
      {
        "title": "3 Coverage Guarantees for No-Regret Algorithms",
        "module": "theory",
        "start_page": 4,
        "end_page": 5,
        "estimated_words": 850
      },
      {
        "title": "4 A Universal-Portfolio Based Strategy",
        "module": "method",
        "start_page": 5,
        "end_page": 8,
        "estimated_words": 770
      },
      {
        "title": "4.1 Coverage Guarantee for UP-OCP",
        "module": "theory",
        "start_page": 7,
        "end_page": 7,
        "estimated_words": 0
      },
      {
        "title": "4.2 Closed-Form Update for Universal Portfolios",
        "module": "method",
        "start_page": 7,
        "end_page": 8,
        "estimated_words": 0
      },
      {
        "title": "5 Experiments",
        "module": "experimental_design",
        "start_page": 8,
        "end_page": 9,
        "estimated_words": 570
      },
      {
        "title": "5.1 Results for AXP",
        "module": "results",
        "start_page": 9,
        "end_page": 10,
        "estimated_words": 510
      },
      {
        "title": "5.2 Results for Synthetic Sinusoid",
        "module": "results",
        "start_page": 11,
        "end_page": 12,
        "estimated_words": 400
      },
      {
        "title": "6 Discussion",
        "module": "conclusion",
        "start_page": 12,
        "end_page": 12,
        "estimated_words": 170
      },
      {
        "title": "Acknowledgements",
        "module": "other",
        "start_page": 12,
        "end_page": 12,
        "estimated_words": 40
      },
      {
        "title": "References",
        "module": "other",
        "start_page": 13,
        "end_page": 15,
        "estimated_words": 1070
      },
      {
        "title": "Appendix A Proof of Theorem 3.1",
        "module": "appendix",
        "start_page": 16,
        "end_page": 16,
        "estimated_words": 468
      },
      {
        "title": "Appendix B Proof of Coverage of OSD",
        "module": "appendix",
        "start_page": 16,
        "end_page": 17,
        "estimated_words": 400
      },
      {
        "title": "Appendix C Asymptotic Coverage from Sublinear Regret",
        "module": "appendix",
        "start_page": 17,
        "end_page": 18,
        "estimated_words": 430
      },
      {
        "title": "Appendix D The Average Size in Stochastic Settings",
        "module": "appendix",
        "start_page": 18,
        "end_page": 20,
        "estimated_words": 1100
      },
      {
        "title": "Appendix E Proof of Theorem 4.3",
        "module": "appendix",
        "start_page": 20,
        "end_page": 22,
        "estimated_words": 1200
      },
      {
        "title": "Appendix F Regret Guarantee of UP-OCP vs KT",
        "module": "appendix",
        "start_page": 23,
        "end_page": 25,
        "estimated_words": 1100
      },
      {
        "title": "Appendix G Closed-Form UP Update",
        "module": "appendix",
        "start_page": 26,
        "end_page": 27,
        "estimated_words": 690
      },
      {
        "title": "Appendix H Baseline Update Rules",
        "module": "appendix",
        "start_page": 27,
        "end_page": 30,
        "estimated_words": 1500
      },
      {
        "title": "Appendix I Score Growth Demonstration",
        "module": "appendix",
        "start_page": 30,
        "end_page": 31,
        "estimated_words": 280
      },
      {
        "title": "Appendix J alpha-Correction",
        "module": "appendix",
        "start_page": 31,
        "end_page": 31,
        "estimated_words": 240
      },
      {
        "title": "Appendix K Full Results for AXP Dataset",
        "module": "appendix",
        "start_page": 31,
        "end_page": 35,
        "estimated_words": 1200
      },
      {
        "title": "Appendix L Additional Experiments",
        "module": "appendix",
        "start_page": 36,
        "end_page": 61,
        "estimated_words": 3600
      },
      {
        "title": "Appendix M Sensitivity of Parameterized Baselines to Hyperparameters",
        "module": "appendix",
        "start_page": 62,
        "end_page": 63,
        "estimated_words": 330
      }
    ],
    "layout_observation": "The verified preprint is single-column. Main figures are centered within the text width; appendix result pages frequently use 2x2 figure grids."
  },
  "module_metrics": [
    {
      "module": "abstract",
      "status": "observed",
      "estimated_words": 170,
      "main_word_share": 0.03,
      "figures": 0,
      "tables": 0,
      "algorithms": 0,
      "displayed_equations": 0
    },
    {
      "module": "introduction",
      "status": "observed",
      "estimated_words": 1020,
      "main_word_share": 0.18,
      "figures": 0,
      "tables": 0,
      "algorithms": 0,
      "displayed_equations": 1
    },
    {
      "module": "related_work",
      "status": "observed",
      "estimated_words": 740,
      "main_word_share": 0.13,
      "figures": 0,
      "tables": 0,
      "algorithms": 0,
      "displayed_equations": 0
    },
    {
      "module": "method",
      "status": "observed",
      "estimated_words": 1250,
      "main_word_share": 0.22,
      "figures": 0,
      "tables": 0,
      "algorithms": 1,
      "displayed_equations": 6
    },
    {
      "module": "theory",
      "status": "observed",
      "estimated_words": 850,
      "main_word_share": 0.15,
      "figures": 0,
      "tables": 0,
      "algorithms": 0,
      "displayed_equations": 5
    },
    {
      "module": "experimental_design",
      "status": "observed",
      "estimated_words": 570,
      "main_word_share": 0.1,
      "figures": 0,
      "tables": 0,
      "algorithms": 0,
      "displayed_equations": 0
    },
    {
      "module": "results",
      "status": "observed",
      "estimated_words": 910,
      "main_word_share": 0.16,
      "figures": 4,
      "tables": 1,
      "algorithms": 0,
      "displayed_equations": 0
    },
    {
      "module": "ablation",
      "status": "not_present",
      "estimated_words": 0,
      "main_word_share": 0.0,
      "figures": 0,
      "tables": 0,
      "algorithms": 0,
      "displayed_equations": 0
    },
    {
      "module": "conclusion",
      "status": "observed",
      "estimated_words": 170,
      "main_word_share": 0.03,
      "figures": 0,
      "tables": 0,
      "algorithms": 0,
      "displayed_equations": 0
    },
    {
      "module": "limitations",
      "status": "not_present",
      "estimated_words": 0,
      "main_word_share": 0.0,
      "figures": 0,
      "tables": 0,
      "algorithms": 0,
      "displayed_equations": 0
    },
    {
      "module": "appendix",
      "status": "observed",
      "estimated_words": 9780,
      "main_word_share": null,
      "figures": 76,
      "tables": 8,
      "algorithms": 5,
      "displayed_equations": 36
    },
    {
      "module": "other",
      "status": "observed",
      "estimated_words": 1110,
      "main_word_share": null,
      "figures": 0,
      "tables": 0,
      "algorithms": 0,
      "displayed_equations": 0
    }
  ],
  "abstract_sentences": [
    {
      "index": 1,
      "text": "Online conformal prediction (OCP) seeks prediction intervals that achieve long-run 1 − α coverage for arbitrary (possibly adversarial) data streams, while remaining as informative as possible.",
      "word_count": 25,
      "functions": [
        "object_scope"
      ],
      "evidence": {
        "page": 1,
        "section": "Abstract",
        "anchor": "arbitrary (possibly adversarial)",
        "basis": "explicit"
      }
    },
    {
      "index": 2,
      "text": "Existing OCP methods often require manual learning-rate tuning to work well, and may also require algorithm-specific analyses.",
      "word_count": 17,
      "functions": [
        "problem_gap"
      ],
      "evidence": {
        "page": 1,
        "section": "Abstract",
        "anchor": "manual learning-rate tuning",
        "basis": "explicit"
      }
    },
    {
      "index": 3,
      "text": "Here, we develop a general regret-to-coverage theory for interval-valued OCP based on the (1 − α)-pinball loss.",
      "word_count": 18,
      "functions": [
        "core_idea",
        "theory"
      ],
      "evidence": {
        "page": 1,
        "section": "Abstract",
        "anchor": "general regret-to-coverage theory",